"﻿name","place","topicAreas","date (dd/MM/yyyy)","paperSubmissionDueDate(dd/MM/yyyy)","paperReviewDueDate(dd/MM/yyyy)","listOfPaperSubmitted"
"Cyber To Security","Clayton","Computer Networks/Security & Cryptography","11/12/2021","11/08/2021","11/10/2021","Security Knowledge/Artificial Intelligence In Security/Computer Network For Security/Security Related To Big Data/AI To Security/Security Technology/Intro to Security/Big Data For Security/Robotic Security"
"Artificial To Intelligence","Caufield","Artificial Intelligence/Human Computer Interaction/Image Processing","15/02/2022","15/12/2021","12/01/2022",""
"Data Mining Talk","MelbourneCity","Data Mining & Information Retrieval/Big Data/Database & Information Systems","17/08/2021","12/06/2021","12/07/2021",""
"Network Structure Technology","Clayton","Computer Networks","14/09/2021","14/07/2021","14/08/2021",""
"Image Processing using AI","caulfield","Artificial Intelligence/Image Processing/Big Data","11/11/2021","11/09/2021","11/10/2021",""
